{
  "$schema": "settings-schema.json",
  "domain": "general-graphics",
  "subDomain": "optimal-synergies",
  "lastUpdated": "2026-01-18",
  "lastVerified": "2026-01-18",
  "confidence": "high",
  "sources": [
    {
      "name": "Gemini Deep Research - Gaming Performance Optimization",
      "type": "gemini-research",
      "date": "2026-01"
    },
    {
      "name": "Digital Foundry Technical Analysis Collection",
      "type": "benchmark",
      "date": "2025"
    },
    {
      "name": "Apple Gaming Performance Guidelines",
      "type": "official-docs",
      "date": "2025"
    }
  ],
  "settings": [
    {
      "id": "max-fps-dlss-performance-low-res",
      "type": "synergy",
      "direction": "enhances",
      "settings": [
        { "category": "upscaling", "setting": "dlss", "value": "performance" },
        { "category": "graphics", "setting": "render-scale", "value": "50" }
      ],
      "relationship": "DLSS Performance mode compounds with lower internal resolution for maximum FPS gains",
      "impact": {
        "performance": { "value": 80, "min": 60, "max": 100, "unit": "percent" },
        "quality": { "value": -30, "min": -40, "max": -20 }
      },
      "confidence": "high",
      "platforms": ["windows"],
      "tags": ["max-fps", "dlss", "upscaling", "competitive"],
      "source": "NVIDIA Performance Guides",
      "sourceDate": "2025",
      "recommendations": [
        "Enable DLSS Performance for maximum frame rate",
        "Pair with 50% render scale for 4x pixel count reduction"
      ]
    },
    {
      "id": "max-fps-fsr-quality-reduced-shadows",
      "type": "synergy",
      "direction": "enhances",
      "settings": [
        { "category": "upscaling", "setting": "fsr", "value": "quality" },
        { "category": "graphics", "setting": "shadows", "value": "low" }
      ],
      "relationship": "FSR Quality with reduced shadows provides balanced visual-performance trade-off",
      "impact": {
        "performance": { "value": 45, "min": 35, "max": 55 },
        "quality": { "value": -15, "min": -25, "max": -10 }
      },
      "confidence": "high",
      "platforms": ["windows", "macos", "linux"],
      "tags": ["balanced", "fsr", "shadows", "performance"],
      "source": "AMD FidelityFX Documentation",
      "sourceDate": "2025",
      "recommendations": [
        "FSR Quality maintains good visual fidelity",
        "Shadows at Low have minimal visual impact in most scenes"
      ]
    },
    {
      "id": "max-fps-frame-cap-vsync-off",
      "type": "synergy",
      "direction": "enhances",
      "settings": [
        { "category": "display", "setting": "frame-cap", "value": "refresh-rate" },
        { "category": "display", "setting": "vsync", "value": "off" }
      ],
      "relationship": "Frame cap at monitor refresh with V-Sync off minimizes input lag while preventing tearing",
      "impact": {
        "latency": { "value": 40, "min": 30, "max": 50, "unit": "ms" },
        "performance": { "value": 5, "min": 0, "max": 10 }
      },
      "confidence": "high",
      "platforms": ["all"],
      "tags": ["input-lag", "competitive", "vsync", "frame-rate"],
      "source": "Competitive Gaming Analysis",
      "sourceDate": "2025",
      "recommendations": [
        "Set frame cap to monitor refresh rate (e.g., 144 for 144Hz)",
        "Disable V-Sync to reduce input latency by up to 16ms"
      ]
    },
    {
      "id": "max-fps-apple-silicon-e-cores",
      "type": "synergy",
      "direction": "enhances",
      "settings": [
        { "category": "performance", "setting": "background-processes", "value": "e-cores" },
        { "category": "performance", "setting": "game-priority", "value": "p-cores" }
      ],
      "relationship": "Routing background tasks to E-cores frees P-cores for game compute",
      "impact": {
        "performance": { "value": 15, "min": 10, "max": 25 }
      },
      "confidence": "medium",
      "platforms": ["macos"],
      "hardware": ["M1", "M1 Pro", "M1 Max", "M1 Ultra", "M2", "M2 Pro", "M2 Max", "M2 Ultra", "M3", "M3 Pro", "M3 Max", "M4", "M4 Pro", "M4 Max"],
      "tags": ["apple-silicon", "cpu-scheduling", "e-cores", "p-cores"],
      "source": "Apple Silicon Optimization Guide",
      "sourceDate": "2025",
      "recommendations": [
        "Use QoS hints to route background work to efficiency cores",
        "Ensure game threads have user-interactive priority"
      ]
    },
    {
      "id": "visual-quality-taa-sharpening",
      "type": "synergy",
      "direction": "enhances",
      "settings": [
        { "category": "graphics", "setting": "aa", "value": "taa" },
        { "category": "graphics", "setting": "sharpening", "value": "50" }
      ],
      "relationship": "TAA smoothing paired with sharpening filter produces cleaner image than either alone",
      "impact": {
        "quality": { "value": 25, "min": 15, "max": 35 },
        "performance": { "value": -5, "min": -10, "max": 0 }
      },
      "confidence": "high",
      "platforms": ["all"],
      "tags": ["visual-quality", "taa", "sharpening", "anti-aliasing"],
      "source": "Digital Foundry Technical Analysis",
      "sourceDate": "2025",
      "recommendations": [
        "TAA reduces shimmer and aliasing",
        "50% sharpening compensates for TAA blur without artifacts"
      ]
    },
    {
      "id": "visual-quality-high-res-film-grain",
      "type": "synergy",
      "direction": "enhances",
      "settings": [
        { "category": "graphics", "setting": "resolution", "value": "4K" },
        { "category": "graphics", "setting": "film-grain", "value": "on" }
      ],
      "relationship": "Film grain at high resolution masks upscaling artifacts and adds cinematic quality",
      "impact": {
        "quality": { "value": 15, "min": 10, "max": 20 }
      },
      "confidence": "medium",
      "platforms": ["all"],
      "tags": ["visual-quality", "4k", "film-grain", "cinematic"],
      "source": "Game Visual Analysis",
      "sourceDate": "2025",
      "recommendations": [
        "Film grain helps hide subtle upscaling artifacts",
        "Works best at native or near-native resolutions"
      ]
    },
    {
      "id": "visual-quality-rt-reflections-gi",
      "type": "synergy",
      "direction": "enhances",
      "settings": [
        { "category": "rt", "setting": "reflections", "value": "on" },
        { "category": "rt", "setting": "global-illumination", "value": "on" }
      ],
      "relationship": "RT Reflections and RT GI create coherent lighting that enhances both effects",
      "impact": {
        "quality": { "value": 50, "min": 40, "max": 60 },
        "performance": { "value": -55, "min": -70, "max": -40 }
      },
      "confidence": "high",
      "platforms": ["windows"],
      "tags": ["ray-tracing", "reflections", "global-illumination", "visual-quality"],
      "source": "NVIDIA RTX Analysis",
      "sourceDate": "2025",
      "recommendations": [
        "Combined RT effects provide coherent lighting model",
        "Consider DLSS Quality to recover performance budget"
      ]
    },
    {
      "id": "visual-quality-dlss-quality-native-hud",
      "type": "synergy",
      "direction": "enhances",
      "settings": [
        { "category": "upscaling", "setting": "dlss", "value": "quality" },
        { "category": "display", "setting": "hud-scale", "value": "native" }
      ],
      "relationship": "DLSS Quality mode with native HUD maintains sharp UI while upscaling game world",
      "impact": {
        "quality": { "value": 20, "min": 15, "max": 25 },
        "performance": { "value": 30, "min": 20, "max": 40 }
      },
      "confidence": "high",
      "platforms": ["windows"],
      "tags": ["dlss", "hud", "visual-quality", "ui"],
      "source": "UI/UX Gaming Analysis",
      "sourceDate": "2025",
      "recommendations": [
        "Render HUD at native resolution for crisp text",
        "DLSS Quality handles 3D world upscaling"
      ]
    },
    {
      "id": "battery-low-power-30fps-cap",
      "type": "synergy",
      "direction": "enhances",
      "settings": [
        { "category": "power", "setting": "low-power-mode", "value": "on" },
        { "category": "display", "setting": "frame-cap", "value": "30" }
      ],
      "relationship": "Low Power Mode with 30fps cap provides up to 3x battery life on Apple Silicon",
      "impact": {
        "power": { "value": 70, "min": 60, "max": 80 },
        "performance": { "value": -50 }
      },
      "confidence": "high",
      "platforms": ["macos"],
      "hardware": ["M1", "M2", "M3", "M4", "M1 Pro", "M2 Pro", "M3 Pro", "M4 Pro"],
      "tags": ["battery-life", "low-power", "frame-cap", "apple-silicon"],
      "source": "Apple Battery Optimization Guide",
      "sourceDate": "2025",
      "recommendations": [
        "Enable Low Power Mode in System Settings",
        "Cap to 30fps for longest battery life"
      ]
    },
    {
      "id": "battery-low-power-reduced-res",
      "type": "synergy",
      "direction": "enhances",
      "settings": [
        { "category": "power", "setting": "low-power-mode", "value": "on" },
        { "category": "graphics", "setting": "render-scale", "value": "75" }
      ],
      "relationship": "Low Power Mode with 75% render scale compounds power savings",
      "impact": {
        "power": { "value": 55, "min": 45, "max": 65 },
        "quality": { "value": -20, "min": -30, "max": -15 }
      },
      "confidence": "high",
      "platforms": ["macos"],
      "hardware": ["M1", "M2", "M3", "M4"],
      "tags": ["battery-life", "low-power", "render-scale", "apple-silicon"],
      "source": "Apple Gaming on MacBook Analysis",
      "sourceDate": "2025",
      "recommendations": [
        "75% render scale is imperceptible on Retina displays",
        "Combine with Low Power Mode for maximum battery savings"
      ]
    },
    {
      "id": "battery-promotion-60hz-medium",
      "type": "synergy",
      "direction": "enhances",